{
  "$schema": "https://json-schema.org/draft/2020-12/schema",
  "$id": "https://sqlobserver.invalid/schemas/m12-vulnerability-scan-contract.v1.schema.json",
  "title": "SqlObserver M12 vulnerability scan contract",
  "type": "object", "additionalProperties": false,
  "required": ["$schema", "schemaVersion", "contractId", "producerId", "artifactKind", "caseId", "environments", "requiredFacts", "factPredicates", "sbomSchema", "outputFiles", "generation", "policy", "bounds"],
  "properties": {
    "$schema": { "const": "m12-vulnerability-scan-contract.v1.schema.json" }, "schemaVersion": { "const": 1 },
    "contractId": { "const": "sqlobserver-m12-vulnerability-scan" }, "producerId": { "const": "m12-supply-chain-harness" }, "artifactKind": { "const": "supply-chain-evidence" }, "caseId": { "const": "m12-vulnerability-scan" },
    "environments": { "const": ["release-windows-server-2022", "release-windows-server-2025"] }, "requiredFacts": { "const": ["os", "architecture", "vulnerabilityScan"] }, "factPredicates": { "const": { "os": "windows", "architecture": "x64", "vulnerabilityScan": true } }, "sbomSchema": { "const": "m12-sbom.v1.schema.json" },
    "outputFiles": { "const": ["m12-vulnerability-scan.json", "m12-vulnerability-scan-test-evidence.json", "m12-vulnerability-scan-provenance.json"] },
    "generation": { "type": "object", "additionalProperties": false, "required": ["deterministic", "timestampSource", "commitSource", "runSource", "dotnetSdk", "node", "pnpm", "dotnetCommand", "pnpmCommand"], "properties": { "deterministic": { "const": true }, "timestampSource": { "const": "supplied" }, "commitSource": { "const": "supplied" }, "runSource": { "const": "supplied" }, "dotnetSdk": { "const": "10.0.203" }, "node": { "const": "22.22.0" }, "pnpm": { "const": "11.19.0" }, "dotnetCommand": { "const": "dotnet list package --vulnerable --include-transitive --format json" }, "pnpmCommand": { "const": "pnpm audit --prod --json" } } },
    "policy": { "type": "object", "additionalProperties": false, "required": ["findings", "unfixable", "unknownSeverity", "registryErrors", "ignoredAdvisories"], "properties": { "findings": { "const": "reject-all" }, "unfixable": { "const": "reject" }, "unknownSeverity": { "const": "reject" }, "registryErrors": { "const": "reject" }, "ignoredAdvisories": { "const": [] } } },
    "bounds": { "type": "object", "additionalProperties": false, "required": ["components", "findings", "jsonBytes", "stringLength", "depth"], "properties": { "components": { "const": 4096 }, "findings": { "const": 4096 }, "jsonBytes": { "const": 4194304 }, "stringLength": { "const": 512 }, "depth": { "const": 32 } } }
  }
}
