{
  "$schema": "m12-vulnerability-scan-contract.v1.schema.json",
  "schemaVersion": 1,
  "contractId": "sqlobserver-m12-vulnerability-scan",
  "producerId": "m12-supply-chain-harness",
  "artifactKind": "supply-chain-evidence",
  "caseId": "m12-vulnerability-scan",
  "environments": ["release-windows-server-2022", "release-windows-server-2025"],
  "requiredFacts": ["os", "architecture", "vulnerabilityScan"],
  "factPredicates": { "os": "windows", "architecture": "x64", "vulnerabilityScan": true },
  "sbomSchema": "m12-sbom.v1.schema.json",
  "outputFiles": ["m12-vulnerability-scan.json", "m12-vulnerability-scan-test-evidence.json", "m12-vulnerability-scan-provenance.json"],
  "generation": {
    "deterministic": true,
    "timestampSource": "supplied",
    "commitSource": "supplied",
    "runSource": "supplied",
    "dotnetSdk": "10.0.203",
    "node": "22.22.0",
    "pnpm": "11.19.0",
    "dotnetCommand": "dotnet list package --vulnerable --include-transitive --format json",
    "pnpmCommand": "pnpm audit --prod --json"
  },
  "policy": {
    "findings": "reject-all",
    "unfixable": "reject",
    "unknownSeverity": "reject",
    "registryErrors": "reject",
    "ignoredAdvisories": []
  },
  "bounds": { "components": 4096, "findings": 4096, "jsonBytes": 4194304, "stringLength": 512, "depth": 32 }
}
